[
  {
    "name": "supreme_court",
    "display_name": null,
    "is_tribunal": false,
    "courts": [
      {
        "code": "UKSC",
        "noun": "court",
        "name": "United Kingdom Supreme Court",
        "long_name": "The Supreme Court",
        "link": "https://www.supremecourt.uk/",
        "ncn_pattern": "\\[(\\d{4})\\] (UKSC) (\\d+)",
        "ncn_examples": [
          "[2013] UKSC 42"
        ],
        "param": "uksc",
        "start_year": 2009,
        "show_in_search_filters": true,
        "show_in_public_directory": true,
        "show_to_editors": true,
        "ended": false,
        "court_of_record": true,
        "relationships": [
          {
            "court_code": "EWCA-Civil",
            "relationship_type": "hears_appeals_from"
          },
          {
            "court_code": "EWCA-Criminal",
            "relationship_type": "hears_appeals_from"
          }
        ],
        "identifier_iri": "https://www.supremecourt.uk/"
      }
    ]
  },
  {
    "name": "privy_council",
    "display_name": null,
    "is_tribunal": false,
    "courts": [
      {
        "code": "UKPC",
        "noun": "court",
        "name": "Privy Council",
        "long_name": "The Judicial Committee of the Privy Council",
        "link": "https://www.jcpc.uk/",
        "ncn_pattern": "\\[(\\d{4})\\] (UKPC) (\\d+)",
        "ncn_examples": [
          "[2011] UKPC 25"
        ],
        "param": "ukpc",
        "start_year": 2009,
        "show_in_search_filters": true,
        "show_in_public_directory": true,
        "show_to_editors": true,
        "ended": false,
        "court_of_record": true,
        "identifier_iri": "https://www.jcpc.uk/"
      }
    ]
  },
  {
    "name": "court_of_appeal",
    "display_name": "Court of Appeal",
    "is_tribunal": false,
    "courts": [
      {
        "code": "EWCA-Civil",
        "noun": "court",
        "grouped_name": "Civil Division",
        "name": "Court of Appeal (Civil Division)",
        "long_name": "The Court of Appeal of England and Wales (Civil Division)",
        "link": "https://www.gov.uk/courts-tribunals/court-of-appeal-civil-division",
        "ncn_pattern": "\\[(\\d{4})\\] (EWCA) (Civ) (\\d+)",
        "ncn_examples": [
          "[2008] EWCA Civ 649"
        ],
        "param": "ewca/civ",
        "start_year": 2001,
        "show_in_search_filters": true,
        "show_in_public_directory": true,
        "show_to_editors": true,
        "ended": false,
        "court_of_record": true,
        "relationships": [
          {
            "court_code": "EWHC",
            "relationship_type": "hears_appeals_from"
          },
          {
            "court_code": "EWHC-Family",
            "relationship_type": "hears_appeals_from"
          }
        ],
        "identifier_iri": "https://www.gov.uk/courts-tribunals/court-of-appeal-civil-division"
      },
      {
        "code": "EWCA-Criminal",
        "noun": "court",
        "grouped_name": "Criminal Division",
        "name": "Court of Appeal (Criminal Division)",
        "long_name": "The Court of Appeal of England and Wales (Criminal Division)",
        "link": "https://www.gov.uk/courts-tribunals/court-of-appeal-criminal-division",
        "ncn_pattern": "\\[(\\d{4})\\] (EWCA) (Crim) (\\d+)",
        "ncn_examples": [
          "[2014] EWCA Crim 420"
        ],
        "param": "ewca/crim",
        "start_year": 2003,
        "show_in_search_filters": true,
        "show_in_public_directory": true,
        "show_to_editors": true,
        "ended": false,
        "court_of_record": true,
        "relationships": [
          {
            "court_code": "EWCR",
            "relationship_type": "hears_appeals_from"
          }
        ],
        "identifier_iri": "https://www.gov.uk/courts-tribunals/court-of-appeal-criminal-division"
      }
    ]
  },
  {
    "name": "high_court",
    "display_name": "High Court (England and Wales)",
    "is_tribunal": false,
    "courts": [
      {
        "code": "EWHC",
        "noun": "court",
        "name": "High Court",
        "long_name": "The High Court of Justice",
        "link": "https://www.judiciary.uk/courts-and-tribunals/high-court/",
        "show_in_search_filters": false,
        "show_in_public_directory": false,
        "show_to_editors": false,
        "ended": false,
        "court_of_record": true,
        "identifier_iri": "https://www.judiciary.uk/courts-and-tribunals/high-court/"
      },
      {
        "code": "EWHC-QBD-Admin",
        "noun": "court",
        "grouped_name": "Administrative Court",
        "name": "High Court (Administrative Court)",
        "long_name": "The Administrative Court (Queen's Bench Division)",
        "link": "https://www.gov.uk/courts-tribunals/administrative-court",
        "ncn_pattern": "\\[(\\d{4})\\] (EWHC) (\\d+) \\((Admin)\\)",
        "ncn_examples": [
          "[2009] EWHC 995 (Admin)"
        ],
        "param": "ewhc/admin",
        "start_year": 2003,
        "show_in_search_filters": true,
        "show_in_public_directory": true,
        "show_to_editors": true,
        "ended": false,
        "court_of_record": true,
        "identifier_iri": "https://www.gov.uk/courts-tribunals/administrative-court"
      },
      {
        "code": "EWHC-KBD-Admin",
        "noun": "court",
        "grouped_name": "Administrative Court",
        "name": "High Court (Administrative Court)",
        "long_name": "The Administrative Court (King's Bench Division)",
        "link": "https://www.gov.uk/courts-tribunals/administrative-court",
        "ncn_pattern": "\\[(\\d{4})\\] (EWHC) (\\d+) \\((Admin)\\)",
        "ncn_examples": [
          "[2025] EWHC 2152 (Admin)"
        ],
        "param": "ewhc/admin",
        "start_year": 2022,
        "show_in_search_filters": false,
        "show_in_public_directory": false,
        "show_to_editors": false,
        "ended": false,
        "court_of_record": true,
        "identifier_iri": "https://www.gov.uk/courts-tribunals/administrative-court"
      },
      {
        "code": "EWHC-QBD-Admiralty",
        "noun": "court",
        "grouped_name": "Admiralty Court",
        "name": "High Court (Admiralty Division)",
        "long_name": "The Business and Property Courts (Admiralty Court)",
        "link": "https://www.gov.uk/courts-tribunals/admiralty-court",
        "ncn_pattern": "\\[(\\d{4})\\] (EWHC) (\\d+) \\((Admlty)\\)",
        "ncn_examples": [
          "[2018] EWHC 82 (Admlty)"
        ],
        "param": "ewhc/admlty",
        "start_year": 2003,
        "show_in_search_filters": true,
        "show_in_public_directory": true,
        "show_to_editors": true,
        "ended": false,
        "court_of_record": true,
        "identifier_iri": "https://www.gov.uk/courts-tribunals/admiralty-court"
      },
      {
        "code": "EWHC-KBD-Admiralty",
        "noun": "court",
        "grouped_name": "Admiralty Court",
        "name": "High Court (Admiralty Division)",
        "long_name": "The Business and Property Courts (Admiralty Court)",
        "link": "https://www.gov.uk/courts-tribunals/admiralty-court",
        "ncn_pattern": "\\[(\\d{4})\\] (EWHC) (\\d+) \\((Admlty)\\)",
        "ncn_examples": [
          "[2024] EWHC 16 (Admlty)"
        ],
        "param": "ewhc/admlty",
        "start_year": 2022,
        "show_in_search_filters": false,
        "show_in_public_directory": false,
        "show_to_editors": false,
        "ended": false,
        "court_of_record": true,
        "identifier_iri": "https://www.gov.uk/courts-tribunals/admiralty-court"
      },
      {
        "code": "EWHC-QBD-BusinessAndProperty",
        "noun": "court",
        "grouped_name": "Business and Property Courts",
        "name": "High Court (Business and Property Courts)",
        "long_name": "The Business and Property Courts (Queen's Bench Division)",
        "link": "https://www.gov.uk/courts-tribunals/the-business-and-property-courts",
        "show_in_search_filters": false,
        "show_in_public_directory": false,
        "show_to_editors": false,
        "ended": false,
        "court_of_record": true,
        "identifier_iri": "https://www.gov.uk/courts-tribunals/the-business-and-property-courts"
      },
      {
        "code": "EWHC-KBD-BusinessAndProperty",
        "noun": "court",
        "grouped_name": "Business and Property Courts",
        "name": "High Courts (Business and Property Courts)",
        "long_name": "The Business and Property Courts (King's Bench Division)",
        "link": "https://www.gov.uk/courts-tribunals/the-business-and-property-courts",
        "show_in_search_filters": false,
        "show_in_public_directory": false,
        "show_to_editors": false,
        "ended": false,
        "court_of_record": true,
        "identifier_iri": "https://www.gov.uk/courts-tribunals/the-business-and-property-courts"
      },
      {
        "code": "EWHC-Chancery-BusinessAndProperty",
        "noun": "court",
        "grouped_name": "Business and Property Courts",
        "name": "High Court (Business and Property Courts)",
        "long_name": "The Business and Property Courts (Chancery Division)",
        "link": "https://www.gov.uk/courts-tribunals/the-business-and-property-courts",
        "show_in_search_filters": false,
        "show_in_public_directory": false,
        "show_to_editors": false,
        "ended": false,
        "court_of_record": true,
        "identifier_iri": "https://www.gov.uk/courts-tribunals/the-business-and-property-courts"
      },
      {
        "code": "EWHC-Chancery-Business",
        "noun": "court",
        "grouped_name": "Business List",
        "name": "High Court (Business List)",
        "long_name": "The Business and Property Courts (Business List)",
        "link": "https://www.gov.uk/courts-tribunals/the-business-list",
        "show_in_search_filters": false,
        "show_in_public_directory": false,
        "show_to_editors": false,
        "ended": false,